{
  "id": "scoundrel",
  "name": "Scoundrel",
  "source": "tanares",
  "hitDie": 8,
  "primaryAbility": [
    "dexterity"
  ],
  "savingThrowProficiencies": [
    "dexterity",
    "intelligence"
  ],
  "armorProficiencies": [
    "light"
  ],
  "weaponProficiencies": [
    "simple",
    "arbalete-de-poing",
    "epee-longue",
    "rapiere",
    "epee-courte"
  ],
  "skillChoices": {
    "count": 4,
    "from": [
      "acrobatics",
      "athletics",
      "deception",
      "insight",
      "intimidation",
      "investigation",
      "perception",
      "performance",
      "persuasion",
      "sleight-of-hand",
      "stealth"
    ]
  },
  "progression": [
    {
      "level": 1,
      "proficiencyBonus": 2,
      "features": [
        "sneak-attack-simplified-scoundrel-s-agility"
      ]
    },
    {
      "level": 2,
      "proficiencyBonus": 2,
      "features": [
        "experience"
      ]
    },
    {
      "level": 3,
      "proficiencyBonus": 2,
      "features": [
        "adventurer-s-aptitude"
      ]
    },
    {
      "level": 4,
      "proficiencyBonus": 2,
      "features": [
        "ability-score-improvement"
      ]
    },
    {
      "level": 5,
      "proficiencyBonus": 3,
      "features": [
        "scoundrel-s-agility-precise-striker"
      ]
    },
    {
      "level": 6,
      "proficiencyBonus": 3,
      "features": [
        "adventurer-s-aptitude"
      ]
    },
    {
      "level": 7,
      "proficiencyBonus": 3,
      "features": [
        "evasion"
      ]
    },
    {
      "level": 8,
      "proficiencyBonus": 3,
      "features": [
        "ability-score-improvement"
      ]
    },
    {
      "level": 9,
      "proficiencyBonus": 4,
      "features": [
        "adventurer-s-aptitude"
      ]
    },
    {
      "level": 10,
      "proficiencyBonus": 4,
      "features": [
        "ability-score-improvement-experience"
      ]
    },
    {
      "level": 11,
      "proficiencyBonus": 4,
      "features": [
        "precise-striker-improvement"
      ]
    },
    {
      "level": 12,
      "proficiencyBonus": 4,
      "features": [
        "ability-score-improvement-adventurer-s-aptitude"
      ]
    },
    {
      "level": 13,
      "proficiencyBonus": 5
    },
    {
      "level": 14,
      "proficiencyBonus": 5
    },
    {
      "level": 15,
      "proficiencyBonus": 5,
      "features": [
        "adventurer-s-aptitude"
      ]
    },
    {
      "level": 16,
      "proficiencyBonus": 5,
      "features": [
        "ability-score-improvement"
      ]
    },
    {
      "level": 17,
      "proficiencyBonus": 6,
      "features": [
        "precise-striker-improvement"
      ]
    },
    {
      "level": 18,
      "proficiencyBonus": 6,
      "features": [
        "experience"
      ]
    },
    {
      "level": 19,
      "proficiencyBonus": 6,
      "features": [
        "ability-score-improvement"
      ]
    },
    {
      "level": 20,
      "proficiencyBonus": 6,
      "features": [
        "scoundrel-s-fortune"
      ]
    }
  ],
  "status": {
    "provisoire": true,
    "raison": "socle provisoire du premier modele de combat : simple a jouer, suffisant pour faire tourner attaques, degats et tours avant le systeme complet de classes",
    "retraitSi": "les seize classes completes sont livrees (LOT-47, LOT-51 a LOT-65) et aucune donnee definitive ne reference ces quatre classes"
  }
}
