{
  "id": "brawler",
  "name": "Brawler",
  "source": "tanares",
  "hitDie": 12,
  "primaryAbility": [
    "strength"
  ],
  "savingThrowProficiencies": [
    "strength",
    "constitution"
  ],
  "armorProficiencies": [
    "light",
    "medium",
    "shields"
  ],
  "weaponProficiencies": [
    "simple",
    "martial"
  ],
  "skillChoices": {
    "count": 2,
    "from": [
      "animal-handling",
      "athletics",
      "intimidation",
      "nature",
      "perception",
      "survival"
    ]
  },
  "progression": [
    {
      "level": 1,
      "proficiencyBonus": 2,
      "features": [
        "tough-as-nails"
      ]
    },
    {
      "level": 2,
      "proficiencyBonus": 2,
      "features": [
        "experience"
      ]
    },
    {
      "level": 3,
      "proficiencyBonus": 2,
      "features": [
        "hit-the-mark"
      ]
    },
    {
      "level": 4,
      "proficiencyBonus": 2,
      "features": [
        "ability-score-improvement"
      ]
    },
    {
      "level": 5,
      "proficiencyBonus": 3,
      "features": [
        "extra-attack"
      ]
    },
    {
      "level": 6,
      "proficiencyBonus": 3,
      "features": [
        "physical-might"
      ]
    },
    {
      "level": 7,
      "proficiencyBonus": 3,
      "features": [
        "powerful-legs"
      ]
    },
    {
      "level": 8,
      "proficiencyBonus": 3,
      "features": [
        "ability-score-improvement"
      ]
    },
    {
      "level": 9,
      "proficiencyBonus": 4,
      "features": [
        "hit-the-mark-improvement"
      ]
    },
    {
      "level": 10,
      "proficiencyBonus": 4,
      "features": [
        "experience"
      ]
    },
    {
      "level": 11,
      "proficiencyBonus": 4,
      "features": [
        "deadly"
      ]
    },
    {
      "level": 12,
      "proficiencyBonus": 4,
      "features": [
        "ability-score-improvement"
      ]
    },
    {
      "level": 13,
      "proficiencyBonus": 5,
      "features": [
        "hit-the-mark-improvement"
      ]
    },
    {
      "level": 14,
      "proficiencyBonus": 5,
      "features": [
        "physical-might-improvement"
      ]
    },
    {
      "level": 15,
      "proficiencyBonus": 5,
      "features": [
        "powerful-legs-improvement"
      ]
    },
    {
      "level": 16,
      "proficiencyBonus": 5,
      "features": [
        "ability-score-improvement"
      ]
    },
    {
      "level": 17,
      "proficiencyBonus": 6,
      "features": [
        "deadly-improvement"
      ]
    },
    {
      "level": 18,
      "proficiencyBonus": 6,
      "features": [
        "experience"
      ]
    },
    {
      "level": 19,
      "proficiencyBonus": 6,
      "features": [
        "ability-score-improvement"
      ]
    },
    {
      "level": 20,
      "proficiencyBonus": 6,
      "features": [
        "barbaric-mastery"
      ]
    }
  ],
  "status": {
    "provisoire": true,
    "raison": "socle provisoire du premier modele de combat : simple a jouer, suffisant pour faire tourner attaques, degats et tours avant le systeme complet de classes",
    "retraitSi": "les seize classes completes sont livrees (LOT-47, LOT-51 a LOT-65) et aucune donnee definitive ne reference ces quatre classes"
  }
}
